,BOAMP_AVIS_NUM,D_10_01_Annulation_Annulinfoannonceanterieur,D_10_01_01_Annulation_Annulinfoannonceanterieur_Reference,D_10_01_01_01_Annulation_Annulinfoannonceanterieur_Reference_Idweb,D_10_01_01_02_Annulation_Annulinfoannonceanterieur_Reference_Typeavis,D_10_01_01_02_01_Annulation_Annulinfoannonceanterieur_Reference_Typeavis_Famille,D_10_01_01_02_01_01_Annulation_Annulinfoannonceanterieur_Reference_Typeavis_Famille_Mapa,D_10_01_01_02_01_02_Annulation_Annulinfoannonceanterieur_Reference_Typeavis_Famille_Fns,D_10_01_01_02_01_03_Annulation_Annulinfoannonceanterieur_Reference_Typeavis_Famille_Joue,D_10_01_01_02_01_04_Annulation_Annulinfoannonceanterieur_Reference_Typeavis_Famille_Dsp,D_10_01_01_02_01_05_Annulation_Annulinfoannonceanterieur_Reference_Typeavis_Famille_Divers,D_10_01_01_02_02_Annulation_Annulinfoannonceanterieur_Reference_Typeavis_Perimetre,D_10_01_01_02_02_01_Annulation_Annulinfoannonceanterieur_Reference_Typeavis_Perimetre_Cmp2006,D_10_01_01_02_02_02_Annulation_Annulinfoannonceanterieur_Reference_Typeavis_Perimetre_Cmp2006DEFENSE,D_10_01_01_02_02_03_Annulation_Annulinfoannonceanterieur_Reference_Typeavis_Perimetre_Directive18,D_10_01_01_02_02_04_Annulation_Annulinfoannonceanterieur_Reference_Typeavis_Perimetre_Directive17,D_10_01_01_02_02_05_Annulation_Annulinfoannonceanterieur_Reference_Typeavis_Perimetre_Directive81,D_10_01_01_02_02_06_Annulation_Annulinfoannonceanterieur_Reference_Typeavis_Perimetre_Directive23,D_10_01_01_02_02_07_Annulation_Annulinfoannonceanterieur_Reference_Typeavis_Perimetre_Directive24,D_10_01_01_02_02_08_Annulation_Annulinfoannonceanterieur_Reference_Typeavis_Perimetre_Directive25,D_10_01_01_02_02_09_Annulation_Annulinfoannonceanterieur_Reference_Typeavis_Perimetre_Dsp,D_10_01_01_02_02_10_Annulation_Annulinfoannonceanterieur_Reference_Typeavis_Perimetre_Autre,D_10_01_01_02_03_Annulation_Annulinfoannonceanterieur_Reference_Typeavis_Nature,D_10_01_01_02_03_01_Annulation_Annulinfoannonceanterieur_Reference_Typeavis_Nature_Preinformation,D_10_01_01_02_03_02_Annulation_Annulinfoannonceanterieur_Reference_Typeavis_Nature_Profilacheteur,D_10_01_01_02_03_03_Annulation_Annulinfoannonceanterieur_Reference_Typeavis_Nature_Appeloffre,D_10_01_01_02_03_03_01_Annulation_Annulinfoannonceanterieur_Reference_Typeavis_Nature_Appeloffre_Standard,D_10_01_01_02_03_03_02_Annulation_Annulinfoannonceanterieur_Reference_Typeavis_Nature_Appeloffre_Concours,D_10_01_01_02_03_03_03_Annulation_Annulinfoannonceanterieur_Reference_Typeavis_Nature_Appeloffre_Periodique,D_10_01_01_02_03_03_04_Annulation_Annulinfoannonceanterieur_Reference_Typeavis_Nature_Appeloffre_Qualification,D_10_01_01_02_03_03_05_Annulation_Annulinfoannonceanterieur_Reference_Typeavis_Nature_Appeloffre_Sad,D_10_01_01_02_03_03_06_Annulation_Annulinfoannonceanterieur_Reference_Typeavis_Nature_Appeloffre_Concession,D_10_01_01_02_03_03_07_Annulation_Annulinfoannonceanterieur_Reference_Typeavis_Nature_Appeloffre_Concessionnaire,D_10_01_01_02_03_04_Annulation_Annulinfoannonceanterieur_Reference_Typeavis_Nature_Intentionconclure,D_10_01_01_02_03_05_Annulation_Annulinfoannonceanterieur_Reference_Typeavis_Nature_Attribution,D_10_01_01_02_03_05_01_Annulation_Annulinfoannonceanterieur_Reference_Typeavis_Nature_Attribution_Standard,D_10_01_01_02_03_05_02_Annulation_Annulinfoannonceanterieur_Reference_Typeavis_Nature_Attribution_Concours,D_10_01_01_02_03_05_03_Annulation_Annulinfoannonceanterieur_Reference_Typeavis_Nature_Attribution_Concession,D_10_01_01_02_03_05_04_Annulation_Annulinfoannonceanterieur_Reference_Typeavis_Nature_Attribution_Standardinfructueuxsanssuite,D_10_01_01_02_03_06_Annulation_Annulinfoannonceanterieur_Reference_Typeavis_Nature_Soustraitance,D_10_01_01_02_03_07_Annulation_Annulinfoannonceanterieur_Reference_Typeavis_Nature_Modification,D_10_01_01_02_03_08_Annulation_Annulinfoannonceanterieur_Reference_Typeavis_Nature_Qualification,D_10_01_01_02_03_09_Annulation_Annulinfoannonceanterieur_Reference_Typeavis_Nature_Rectificatif,D_10_01_01_02_03_10_Annulation_Annulinfoannonceanterieur_Reference_Typeavis_Nature_Periodique,D_10_01_01_02_03_11_Annulation_Annulinfoannonceanterieur_Reference_Typeavis_Nature_Autre,D_10_01_01_02_04_Annulation_Annulinfoannonceanterieur_Reference_Typeavis_Statut,D_10_01_01_02_04_01_Annulation_Annulinfoannonceanterieur_Reference_Typeavis_Statut_Initial,D_10_01_01_02_04_02_Annulation_Annulinfoannonceanterieur_Reference_Typeavis_Statut_Rectificatif,D_10_01_01_02_04_03_Annulation_Annulinfoannonceanterieur_Reference_Typeavis_Statut_Annulation,D_10_01_01_02_04_04_Annulation_Annulinfoannonceanterieur_Reference_Typeavis_Statut_Modification,D_10_01_01_03_Annulation_Annulinfoannonceanterieur_Reference_Dateenvoi,D_10_01_02_Annulation_Annulinfoannonceanterieur_Referencepublication,D_10_01_02_01_Annulation_Annulinfoannonceanterieur_Referencepublication_Publicationpapier,D_10_01_02_02_Annulation_Annulinfoannonceanterieur_Referencepublication_Publicationelectronique,D_10_01_02_02_01_Annulation_Annulinfoannonceanterieur_Referencepublication_Publicationelectronique_Datepublication,D_10_01_02_02_02_Annulation_Annulinfoannonceanterieur_Referencepublication_Publicationelectronique_Datefindiffusion,D_10_01_02_03_Annulation_Annulinfoannonceanterieur_Referencepublication_Publicationjoue,D_10_01_02_03_01_Annulation_Annulinfoannonceanterieur_Referencepublication_Publicationjoue_Annee,D_10_01_02_03_02_Annulation_Annulinfoannonceanterieur_Referencepublication_Publicationjoue_Numparution,D_10_01_02_03_03_Annulation_Annulinfoannonceanterieur_Referencepublication_Publicationjoue_Numannonce,D_10_01_02_03_04_Annulation_Annulinfoannonceanterieur_Referencepublication_Publicationjoue_Datepublication,D_10_02_Annulation_Motif
0,21-25704,CF_NIV_SUIV,CF_NIV_SUIV,21-16403,CF_NIV_SUIV,CF_NIV_SUIV,False,True,False,,,CF_NIV_SUIV,True,,,,False,,,,,,CF_NIV_SUIV,,,CF_NIV_SUIV,,,,,,,,,CF_NIV_SUIV,,,,,,,,,,,CF_NIV_SUIV,True,,,,,CF_NIV_SUIV,[],CF_NIV_SUIV,2021-02-18 23:00:00,2021-03-30 22:00:00,CF_NIV_SUIV,,,,,Déclaration sans suite de la consultation pour motif d'intérêt général suivant : redéfinition du besoin.
1,21-27979,CF_NIV_SUIV,CF_NIV_SUIV,21-21761,CF_NIV_SUIV,CF_NIV_SUIV,True,False,False,,,CF_NIV_SUIV,True,,,,False,,,,,,CF_NIV_SUIV,,,CF_NIV_SUIV,,,,,,,,,CF_NIV_SUIV,,,,,,,,,,,CF_NIV_SUIV,True,,,,,CF_NIV_SUIV,[],CF_NIV_SUIV,2021-02-15 23:00:00,2021-03-24 23:00:00,CF_NIV_SUIV,,,,,Annulation de la procédure pour cause d'intérêt général
2,21-28197,CF_NIV_SUIV,CF_NIV_SUIV,21-27616,CF_NIV_SUIV,CF_NIV_SUIV,False,True,False,,,CF_NIV_SUIV,True,,,,False,,,,,,CF_NIV_SUIV,,,CF_NIV_SUIV,,,,,,,,,CF_NIV_SUIV,,,,,,,,,,,CF_NIV_SUIV,True,,,,,CF_NIV_SUIV,[],CF_NIV_SUIV,2021-02-28 23:00:00,2021-03-24 23:00:00,CF_NIV_SUIV,,,,,Erreur de mise en ligne
3,21-28226,CF_NIV_SUIV,CF_NIV_SUIV,21-15410,CF_NIV_SUIV,CF_NIV_SUIV,True,False,False,,,CF_NIV_SUIV,True,,,,False,,,,,,CF_NIV_SUIV,,,CF_NIV_SUIV,,,,,,,,,CF_NIV_SUIV,,,,,,,,,,,CF_NIV_SUIV,True,,,,,CF_NIV_SUIV,[],CF_NIV_SUIV,2021-02-01 23:00:00,2021-03-02 23:00:00,CF_NIV_SUIV,,,,,Marché déclaré sans suite au motif d'intérêt général (Report de la manifestation en 2022 à cause de la pandémie de Covid19) en application des articles R2185-1 et 2 du Code de la commande publique.
4,21-28228,CF_NIV_SUIV,CF_NIV_SUIV,21-18804,CF_NIV_SUIV,CF_NIV_SUIV,True,False,False,,,CF_NIV_SUIV,True,,,,False,,,,,,CF_NIV_SUIV,,,CF_NIV_SUIV,,,,,,,,,CF_NIV_SUIV,,,,,,,,,,,CF_NIV_SUIV,True,,,,,CF_NIV_SUIV,[],CF_NIV_SUIV,2021-02-09 23:00:00,2021-03-09 23:00:00,CF_NIV_SUIV,,,,,Marché déclaré sans suite au motif d'intérêt général (Report de la manifestation en 2022 à cause de la pandémie de Covid19) en application des articles R2185-1 et 2 du Code de la commande publique.
5,21-28834,CF_NIV_SUIV,CF_NIV_SUIV,20-120345,CF_NIV_SUIV,CF_NIV_SUIV,False,True,False,,,CF_NIV_SUIV,True,,,,False,,,,,,CF_NIV_SUIV,,,CF_NIV_SUIV,,,,,,,,,CF_NIV_SUIV,,,,,,,,,,,CF_NIV_SUIV,True,,,,,CF_NIV_SUIV,[],CF_NIV_SUIV,2020-10-01 22:00:00,2020-10-25 23:00:00,CF_NIV_SUIV,,,,,"Conformément à l'article R.2185-1 du Code de la commande publique, la procédure est déclarée sans suite pour des motifs d'intérêt général.En effet, lors de l'analyse des offres, les écarts entre les offres financières ont souligné la nécessité d'affiner la définition des besoins.En parallèle, la Ville a fait l'objet d'une cyber-attaque entre le 29 et le 31 janvier 2021, imposant la refonte complète de l'infrastructure serveurs."
6,21-29063,CF_NIV_SUIV,CF_NIV_SUIV,20-65074,CF_NIV_SUIV,CF_NIV_SUIV,False,False,True,,,CF_NIV_SUIV,False,,,,True,,,,,,CF_NIV_SUIV,,,CF_NIV_SUIV,,,,,,,,,CF_NIV_SUIV,,,,,,,,,,,CF_NIV_SUIV,True,,,,,CF_NIV_SUIV,[],CF_NIV_SUIV,2020-05-18 22:00:00,2020-07-16 22:00:00,CF_NIV_SUIV,,,,,La procédure a été déclarée sans suite.
7,21-29063,CF_NIV_SUIV,CF_NIV_SUIV,20-65074,CF_NIV_SUIV,CF_NIV_SUIV,False,False,True,,,CF_NIV_SUIV,False,,,,True,,,,,,CF_NIV_SUIV,,,CF_NIV_SUIV,,,,,,,,,CF_NIV_SUIV,,,,,,,,,,,CF_NIV_SUIV,True,,,,,CF_NIV_SUIV,[],CF_NIV_SUIV,,,CF_NIV_SUIV,2020.0,98.0,235902.0,2020-05-19 22:00:00,La procédure a été déclarée sans suite.
8,21-30349,CF_NIV_SUIV,CF_NIV_SUIV,20-94059,CF_NIV_SUIV,CF_NIV_SUIV,False,True,False,,,CF_NIV_SUIV,True,,,,False,,,,,,CF_NIV_SUIV,,,CF_NIV_SUIV,,,,,,,,,CF_NIV_SUIV,,,,,,,,,,,CF_NIV_SUIV,True,,,,,CF_NIV_SUIV,[],CF_NIV_SUIV,2020-07-22 22:00:00,2020-09-29 22:00:00,CF_NIV_SUIV,,,,,"La procédure est déclarée sans suite pour motifs techniques suite à la présence d'erreurs dans les exigences techniques des prestations, rendant impossible le choix de l'offre économiquement la plus avantageuse. Une nouvelle procédure sera mise en oeuvre."
9,21-30478,CF_NIV_SUIV,CF_NIV_SUIV,21-30279,CF_NIV_SUIV,CF_NIV_SUIV,False,True,False,,,CF_NIV_SUIV,True,,,,False,,,,,,CF_NIV_SUIV,,,CF_NIV_SUIV,,,,,,,,,CF_NIV_SUIV,,,,,,,,,,,CF_NIV_SUIV,True,,,,,CF_NIV_SUIV,[],CF_NIV_SUIV,2021-03-05 23:00:00,2021-04-01 22:00:00,CF_NIV_SUIV,,,,,Avis publié via la plateforme PLACE sous le numéro 3633129 correspondant à l'avis BOAMP 21-30825
10,21-31268,CF_NIV_SUIV,CF_NIV_SUIV,21-30215,CF_NIV_SUIV,CF_NIV_SUIV,False,True,False,,,CF_NIV_SUIV,True,,,,False,,,,,,CF_NIV_SUIV,,,CF_NIV_SUIV,,,,,,,,,CF_NIV_SUIV,,,,,,,,,,,CF_NIV_SUIV,True,,,,,CF_NIV_SUIV,[],CF_NIV_SUIV,2021-03-04 23:00:00,2021-05-29 22:00:00,CF_NIV_SUIV,,,,,La présente consultation est déclarée sans suite en raison d'une erreur de procédure. Elle sera relancée ultérieurement.
11,21-31304,CF_NIV_SUIV,CF_NIV_SUIV,21-20943,CF_NIV_SUIV,CF_NIV_SUIV,False,True,False,,,CF_NIV_SUIV,True,,,,False,,,,,,CF_NIV_SUIV,,,CF_NIV_SUIV,,,,,,,,,CF_NIV_SUIV,,,,,,,,,,,CF_NIV_SUIV,True,,,,,CF_NIV_SUIV,[],CF_NIV_SUIV,2021-02-14 23:00:00,2021-03-15 23:00:00,CF_NIV_SUIV,,,,,"La présente consultation est annulée. Afin de préserver l'égalité entre les candidats, des éléments complémentaires seront intégrés lors du lancement d'une prochaine consultation."
12,21-31767,CF_NIV_SUIV,CF_NIV_SUIV,21-31587,CF_NIV_SUIV,CF_NIV_SUIV,False,True,False,,,CF_NIV_SUIV,True,,,,False,,,,,,CF_NIV_SUIV,,,CF_NIV_SUIV,,,,,,,,,CF_NIV_SUIV,,,,,,,,,,,CF_NIV_SUIV,True,,,,,CF_NIV_SUIV,[],CF_NIV_SUIV,2021-03-08 23:00:00,2021-04-11 22:00:00,CF_NIV_SUIV,,,,,"Erreur sur le type de publicité du marché : conformément à l'avis relatif aux contrats de la commande publique ayant pour objet des services sociaux et autres services spécifique (NOR : ECOM1831822V et JORF no0077 du 31 mars 2019) le marché concernant ce projet, compte tenu de son montant estimatif, doit faire l'objet d'une publicité européenne.Le marché fait l'objet d'une nouvelle procédure référencée 21PA07."
13,21-31790,CF_NIV_SUIV,CF_NIV_SUIV,21-26326,CF_NIV_SUIV,CF_NIV_SUIV,False,True,False,,,CF_NIV_SUIV,True,,,,False,,,,,,CF_NIV_SUIV,,,CF_NIV_SUIV,,,,,,,,,CF_NIV_SUIV,,,,,,,,,,,CF_NIV_SUIV,True,,,,,CF_NIV_SUIV,[],CF_NIV_SUIV,2021-02-24 23:00:00,2021-03-23 23:00:00,CF_NIV_SUIV,,,,,"Suite à une erreur concernant le lot no3, la procédure doit être déclarée sans suite. Une nouvelle procédure sera bientôt lancée."
14,21-31969,CF_NIV_SUIV,CF_NIV_SUIV,21-27552,CF_NIV_SUIV,CF_NIV_SUIV,True,False,False,,,CF_NIV_SUIV,True,,,,False,,,,,,CF_NIV_SUIV,,,CF_NIV_SUIV,,,,,,,,,CF_NIV_SUIV,,,,,,,,,,,CF_NIV_SUIV,True,,,,,CF_NIV_SUIV,[],CF_NIV_SUIV,2021-02-28 23:00:00,2021-03-20 23:00:00,CF_NIV_SUIV,,,,,Cette consultation a été classée sans suite
15,21-32774,CF_NIV_SUIV,CF_NIV_SUIV,21-30889,CF_NIV_SUIV,CF_NIV_SUIV,False,True,False,,,CF_NIV_SUIV,True,,,,False,,,,,,CF_NIV_SUIV,,,CF_NIV_SUIV,,,,,,,,,CF_NIV_SUIV,,,,,,,,,,,CF_NIV_SUIV,True,,,,,CF_NIV_SUIV,[],CF_NIV_SUIV,2021-03-07 23:00:00,2021-03-29 22:00:00,CF_NIV_SUIV,,,,,Rédaction erronée
16,21-33065,CF_NIV_SUIV,CF_NIV_SUIV,21-25168,CF_NIV_SUIV,CF_NIV_SUIV,False,True,False,,,CF_NIV_SUIV,True,,,,False,,,,,,CF_NIV_SUIV,,,CF_NIV_SUIV,,,,,,,,,CF_NIV_SUIV,,,,,,,,,,,CF_NIV_SUIV,True,,,,,CF_NIV_SUIV,[],CF_NIV_SUIV,2021-02-22 23:00:00,2021-03-26 23:00:00,CF_NIV_SUIV,,,,,"Conformément à l'article R 2185-1 du code de la commande publique , les candidats sont informés que le pouvoir adjudicateur, annule la procédure pour motifs d'intérêt général, à savoir abandon du besoin. Ce marché sera lancé ultérieurement par le Conseil Départemental de la Seine Maritime"
17,21-33826,CF_NIV_SUIV,CF_NIV_SUIV,21-33409,CF_NIV_SUIV,CF_NIV_SUIV,True,False,False,,,CF_NIV_SUIV,True,,,,False,,,,,,CF_NIV_SUIV,,,CF_NIV_SUIV,,,,,,,,,CF_NIV_SUIV,,,,,,,,,,,CF_NIV_SUIV,True,,,,,CF_NIV_SUIV,[],CF_NIV_SUIV,2021-03-11 23:00:00,2021-04-19 22:00:00,CF_NIV_SUIV,,,,,Marché saisi dans la mauvaise procédure
18,21-34608,CF_NIV_SUIV,CF_NIV_SUIV,21-24920,CF_NIV_SUIV,CF_NIV_SUIV,False,True,False,,,CF_NIV_SUIV,True,,,,False,,,,,,CF_NIV_SUIV,,,CF_NIV_SUIV,,,,,,,,,CF_NIV_SUIV,,,,,,,,,,,CF_NIV_SUIV,True,,,,,CF_NIV_SUIV,[],CF_NIV_SUIV,2021-02-22 23:00:00,2021-05-15 22:00:00,CF_NIV_SUIV,,,,,"Déclaration sans suite pour motif d'intérêt général. Le marché sera relancé très prochainement, avec une évolution des conditions liées à la durée du marché public."
19,21-34720,CF_NIV_SUIV,CF_NIV_SUIV,21-33863,CF_NIV_SUIV,CF_NIV_SUIV,False,True,False,,,CF_NIV_SUIV,True,,,,False,,,,,,CF_NIV_SUIV,,,CF_NIV_SUIV,,,,,,,,,CF_NIV_SUIV,,,,,,,,,,,CF_NIV_SUIV,True,,,,,CF_NIV_SUIV,[],CF_NIV_SUIV,2021-03-14 23:00:00,2021-05-20 22:00:00,CF_NIV_SUIV,,,,,Pas de négociation
