,BOAMP_AVIS_NUM,D_14_01_Conditionparticipationsystmequalif_Conditions,D_14_02_Conditionparticipationsystmequalif_Methodeverification
6,21-67251,voir le règlement de consultation,
7,21-67307,Les informations sont mentionnées dans le DCE,Les informations sont mentionnées dans le DCE
8,21-68332,Se reporter au règlement de la consultation.,
9,21-70665,Critères de sélection tels que défini au règlement de consultation,
10,21-70843,voir CCP,Voir CCP
11,21-70851,"Le marché sera conclu soit avec une entreprise individuelle, soit avec un groupement conjoint ou solidaire. En application de l'article R.2142-21 du code de la commande publique, il est interdit aux candidats de présenter plusieurs offres, en agissant à la fois en qualité de candidats individuels et de membres d'un groupement, ou en qualité de membres de plusieurs groupements.En application de l'article R.2142-24 du code susvisé, dans le cas d'un groupement conjoint, le mandataire du groupement conjoint sera solidaire, pour l'exécution du marché, de chacun des membres du groupement pour ses obligations contractuelles à l'égard de l'acheteur.Le nombre de candidats n'est pas limité.",
