,BOAMP_AVIS_NUM,D_10_01_Annulation_Annulinfoannonceanterieur,D_10_01_01_Annulation_Annulinfoannonceanterieur_Reference,D_10_01_01_01_Annulation_Annulinfoannonceanterieur_Reference_Idweb,D_10_01_01_02_Annulation_Annulinfoannonceanterieur_Reference_Typeavis,D_10_01_01_02_01_Annulation_Annulinfoannonceanterieur_Reference_Typeavis_Famille,D_10_01_01_02_01_01_Annulation_Annulinfoannonceanterieur_Reference_Typeavis_Famille_Mapa,D_10_01_01_02_01_02_Annulation_Annulinfoannonceanterieur_Reference_Typeavis_Famille_Fns,D_10_01_01_02_01_03_Annulation_Annulinfoannonceanterieur_Reference_Typeavis_Famille_Joue,D_10_01_01_02_01_04_Annulation_Annulinfoannonceanterieur_Reference_Typeavis_Famille_Dsp,D_10_01_01_02_01_05_Annulation_Annulinfoannonceanterieur_Reference_Typeavis_Famille_Divers,D_10_01_01_02_02_Annulation_Annulinfoannonceanterieur_Reference_Typeavis_Perimetre,D_10_01_01_02_02_01_Annulation_Annulinfoannonceanterieur_Reference_Typeavis_Perimetre_Cmp2006,D_10_01_01_02_02_02_Annulation_Annulinfoannonceanterieur_Reference_Typeavis_Perimetre_Cmp2006DEFENSE,D_10_01_01_02_02_03_Annulation_Annulinfoannonceanterieur_Reference_Typeavis_Perimetre_Directive18,D_10_01_01_02_02_04_Annulation_Annulinfoannonceanterieur_Reference_Typeavis_Perimetre_Directive17,D_10_01_01_02_02_05_Annulation_Annulinfoannonceanterieur_Reference_Typeavis_Perimetre_Directive81,D_10_01_01_02_02_06_Annulation_Annulinfoannonceanterieur_Reference_Typeavis_Perimetre_Directive23,D_10_01_01_02_02_07_Annulation_Annulinfoannonceanterieur_Reference_Typeavis_Perimetre_Directive24,D_10_01_01_02_02_08_Annulation_Annulinfoannonceanterieur_Reference_Typeavis_Perimetre_Directive25,D_10_01_01_02_02_09_Annulation_Annulinfoannonceanterieur_Reference_Typeavis_Perimetre_Dsp,D_10_01_01_02_02_10_Annulation_Annulinfoannonceanterieur_Reference_Typeavis_Perimetre_Autre,D_10_01_01_02_03_Annulation_Annulinfoannonceanterieur_Reference_Typeavis_Nature,D_10_01_01_02_03_01_Annulation_Annulinfoannonceanterieur_Reference_Typeavis_Nature_Preinformation,D_10_01_01_02_03_02_Annulation_Annulinfoannonceanterieur_Reference_Typeavis_Nature_Profilacheteur,D_10_01_01_02_03_03_Annulation_Annulinfoannonceanterieur_Reference_Typeavis_Nature_Appeloffre,D_10_01_01_02_03_03_01_Annulation_Annulinfoannonceanterieur_Reference_Typeavis_Nature_Appeloffre_Standard,D_10_01_01_02_03_03_02_Annulation_Annulinfoannonceanterieur_Reference_Typeavis_Nature_Appeloffre_Concours,D_10_01_01_02_03_03_03_Annulation_Annulinfoannonceanterieur_Reference_Typeavis_Nature_Appeloffre_Periodique,D_10_01_01_02_03_03_04_Annulation_Annulinfoannonceanterieur_Reference_Typeavis_Nature_Appeloffre_Qualification,D_10_01_01_02_03_03_05_Annulation_Annulinfoannonceanterieur_Reference_Typeavis_Nature_Appeloffre_Sad,D_10_01_01_02_03_03_06_Annulation_Annulinfoannonceanterieur_Reference_Typeavis_Nature_Appeloffre_Concession,D_10_01_01_02_03_03_07_Annulation_Annulinfoannonceanterieur_Reference_Typeavis_Nature_Appeloffre_Concessionnaire,D_10_01_01_02_03_04_Annulation_Annulinfoannonceanterieur_Reference_Typeavis_Nature_Intentionconclure,D_10_01_01_02_03_05_Annulation_Annulinfoannonceanterieur_Reference_Typeavis_Nature_Attribution,D_10_01_01_02_03_05_01_Annulation_Annulinfoannonceanterieur_Reference_Typeavis_Nature_Attribution_Standard,D_10_01_01_02_03_05_02_Annulation_Annulinfoannonceanterieur_Reference_Typeavis_Nature_Attribution_Concours,D_10_01_01_02_03_05_03_Annulation_Annulinfoannonceanterieur_Reference_Typeavis_Nature_Attribution_Concession,D_10_01_01_02_03_05_04_Annulation_Annulinfoannonceanterieur_Reference_Typeavis_Nature_Attribution_Standardinfructueuxsanssuite,D_10_01_01_02_03_06_Annulation_Annulinfoannonceanterieur_Reference_Typeavis_Nature_Soustraitance,D_10_01_01_02_03_07_Annulation_Annulinfoannonceanterieur_Reference_Typeavis_Nature_Modification,D_10_01_01_02_03_08_Annulation_Annulinfoannonceanterieur_Reference_Typeavis_Nature_Qualification,D_10_01_01_02_03_09_Annulation_Annulinfoannonceanterieur_Reference_Typeavis_Nature_Rectificatif,D_10_01_01_02_03_10_Annulation_Annulinfoannonceanterieur_Reference_Typeavis_Nature_Periodique,D_10_01_01_02_03_11_Annulation_Annulinfoannonceanterieur_Reference_Typeavis_Nature_Autre,D_10_01_01_02_04_Annulation_Annulinfoannonceanterieur_Reference_Typeavis_Statut,D_10_01_01_02_04_01_Annulation_Annulinfoannonceanterieur_Reference_Typeavis_Statut_Initial,D_10_01_01_02_04_02_Annulation_Annulinfoannonceanterieur_Reference_Typeavis_Statut_Rectificatif,D_10_01_01_02_04_03_Annulation_Annulinfoannonceanterieur_Reference_Typeavis_Statut_Annulation,D_10_01_01_02_04_04_Annulation_Annulinfoannonceanterieur_Reference_Typeavis_Statut_Modification,D_10_01_01_03_Annulation_Annulinfoannonceanterieur_Reference_Dateenvoi,D_10_01_02_Annulation_Annulinfoannonceanterieur_Referencepublication,D_10_01_02_01_Annulation_Annulinfoannonceanterieur_Referencepublication_Publicationpapier,D_10_01_02_02_Annulation_Annulinfoannonceanterieur_Referencepublication_Publicationelectronique,D_10_01_02_02_01_Annulation_Annulinfoannonceanterieur_Referencepublication_Publicationelectronique_Datepublication,D_10_01_02_02_02_Annulation_Annulinfoannonceanterieur_Referencepublication_Publicationelectronique_Datefindiffusion,D_10_01_02_03_Annulation_Annulinfoannonceanterieur_Referencepublication_Publicationjoue,D_10_01_02_03_01_Annulation_Annulinfoannonceanterieur_Referencepublication_Publicationjoue_Annee,D_10_01_02_03_02_Annulation_Annulinfoannonceanterieur_Referencepublication_Publicationjoue_Numparution,D_10_01_02_03_03_Annulation_Annulinfoannonceanterieur_Referencepublication_Publicationjoue_Numannonce,D_10_01_02_03_04_Annulation_Annulinfoannonceanterieur_Referencepublication_Publicationjoue_Datepublication,D_10_02_Annulation_Motif
20,21-93233,CF_NIV_SUIV,CF_NIV_SUIV,21-91601,CF_NIV_SUIV,CF_NIV_SUIV,True,False,False,,,CF_NIV_SUIV,True,,,,False,,,,,,CF_NIV_SUIV,,,CF_NIV_SUIV,,,,,,,,,CF_NIV_SUIV,,,,,,,,,,,CF_NIV_SUIV,True,,,,,CF_NIV_SUIV,[],CF_NIV_SUIV,2021-07-01 22:00:00,2021-07-29 22:00:00,CF_NIV_SUIV,,,,,mauvaise procédure choisie
21,21-93558,CF_NIV_SUIV,CF_NIV_SUIV,21-93122,CF_NIV_SUIV,CF_NIV_SUIV,False,True,False,,,CF_NIV_SUIV,True,,,,False,,,,,,CF_NIV_SUIV,,,CF_NIV_SUIV,,,,,,,,,CF_NIV_SUIV,,,,,,,,,,,CF_NIV_SUIV,True,,,,,CF_NIV_SUIV,[],CF_NIV_SUIV,2021-07-05 22:00:00,2021-09-01 22:00:00,CF_NIV_SUIV,,,,,Erreur logicielle dans la procédure.
22,21-94116,CF_NIV_SUIV,CF_NIV_SUIV,21-75202,CF_NIV_SUIV,CF_NIV_SUIV,False,False,True,,,CF_NIV_SUIV,False,,,,True,,,,,,CF_NIV_SUIV,,,CF_NIV_SUIV,,,,,,,,,CF_NIV_SUIV,,,,,,,,,,,CF_NIV_SUIV,True,,,,,CF_NIV_SUIV,[],CF_NIV_SUIV,2021-06-24 22:00:00,2021-07-25 22:00:00,CF_NIV_SUIV,,,,,Motif de l'annulation : Erreur matérielle portant sur la procédure
23,21-94116,CF_NIV_SUIV,CF_NIV_SUIV,21-75202,CF_NIV_SUIV,CF_NIV_SUIV,False,False,True,,,CF_NIV_SUIV,False,,,,True,,,,,,CF_NIV_SUIV,,,CF_NIV_SUIV,,,,,,,,,CF_NIV_SUIV,,,,,,,,,,,CF_NIV_SUIV,True,,,,,CF_NIV_SUIV,[],CF_NIV_SUIV,,,CF_NIV_SUIV,2021.0,122.0,324692.0,2021-06-27 22:00:00,Motif de l'annulation : Erreur matérielle portant sur la procédure
24,21-94551,CF_NIV_SUIV,CF_NIV_SUIV,21-81813,CF_NIV_SUIV,CF_NIV_SUIV,False,True,False,,,CF_NIV_SUIV,True,,,,False,,,,,,CF_NIV_SUIV,,,CF_NIV_SUIV,,,,,,,,,CF_NIV_SUIV,,,,,,,,,,,CF_NIV_SUIV,True,,,,,CF_NIV_SUIV,[],CF_NIV_SUIV,2021-06-14 22:00:00,2021-07-15 22:00:00,CF_NIV_SUIV,,,,,"La présente consultation est annulée pour le motif suivant : le marché sera décomposé en marché comportant une tranche ferme et une tranche optionnelle, avec un nouveau dossier de consultation modifié en ce sens. Une nouvelle consultation sera par conséquent lancée."
25,21-94775,CF_NIV_SUIV,CF_NIV_SUIV,21-91493,CF_NIV_SUIV,CF_NIV_SUIV,False,True,False,,,CF_NIV_SUIV,True,,,,False,,,,,,CF_NIV_SUIV,,,CF_NIV_SUIV,,,,,,,,,CF_NIV_SUIV,,,,,,,,,,,CF_NIV_SUIV,True,,,,,CF_NIV_SUIV,[],CF_NIV_SUIV,2021-07-01 22:00:00,2021-09-22 22:00:00,CF_NIV_SUIV,,,,,"La procédure MAPA pour le marché public de travaux du Tribunal est annulée pour des motifs de protection de l'intérêt général : choix du mode de procédure inadaptée au vu du montant des travaux, A relancer en appel d'offres ouvert"
26,21-94963,CF_NIV_SUIV,CF_NIV_SUIV,21-94199,CF_NIV_SUIV,CF_NIV_SUIV,False,True,False,,,CF_NIV_SUIV,True,,,,False,,,,,,CF_NIV_SUIV,,,CF_NIV_SUIV,,,,,,,,,CF_NIV_SUIV,,,,,,,,,,,CF_NIV_SUIV,True,,,,,CF_NIV_SUIV,[],CF_NIV_SUIV,2021-07-06 22:00:00,2021-07-28 22:00:00,CF_NIV_SUIV,,,,,Disparition temporaire du besoin
27,21-95066,CF_NIV_SUIV,CF_NIV_SUIV,21-94345,CF_NIV_SUIV,CF_NIV_SUIV,True,False,False,,,CF_NIV_SUIV,True,,,,False,,,,,,CF_NIV_SUIV,,,CF_NIV_SUIV,,,,,,,,,CF_NIV_SUIV,,,,,,,,,,,CF_NIV_SUIV,True,,,,,CF_NIV_SUIV,[],CF_NIV_SUIV,2021-07-06 22:00:00,2021-07-29 22:00:00,CF_NIV_SUIV,,,,,"Le type de procédure n'est pas conforme au Code de la Commande Publique.L'estimation du marché est supérieur à 90 000euro.De ce fait, nouvelle publication 'AVIS NATIONAL'"
28,21-95133,CF_NIV_SUIV,CF_NIV_SUIV,21-94658,CF_NIV_SUIV,CF_NIV_SUIV,False,True,False,,,CF_NIV_SUIV,True,,,,False,,,,,,CF_NIV_SUIV,,,CF_NIV_SUIV,,,,,,,,,CF_NIV_SUIV,,,,,,,,,,,CF_NIV_SUIV,True,,,,,CF_NIV_SUIV,[],CF_NIV_SUIV,2021-07-06 22:00:00,2021-07-14 22:00:00,CF_NIV_SUIV,,,,,Marché non publié au JOUE
29,21-95208,CF_NIV_SUIV,CF_NIV_SUIV,21-91473,CF_NIV_SUIV,CF_NIV_SUIV,False,True,False,,,CF_NIV_SUIV,True,,,,False,,,,,,CF_NIV_SUIV,,,CF_NIV_SUIV,,,,,,,,,CF_NIV_SUIV,,,,,,,,,,,CF_NIV_SUIV,True,,,,,CF_NIV_SUIV,[],CF_NIV_SUIV,2021-07-01 22:00:00,2021-08-03 22:00:00,CF_NIV_SUIV,,,,,"Madame, Monsieur, Nous sommes au regret de vous informer que, conformément aux dispositions du Code des Marchés Publics, nous avons décidé de déclarer cette procédure sans suite pour motifs d'intérêt général. Des faits nouveaux apparus après la mise en concurrence mettent en jeu la définition du besoin qui avait été effectué pour ce marché. Nous vous prions d'agréer, Madame, Monsieur, l'expression de toute notre considération et de notre entier dévouement."
30,21-95660,CF_NIV_SUIV,CF_NIV_SUIV,21-53725,CF_NIV_SUIV,CF_NIV_SUIV,False,True,False,,,CF_NIV_SUIV,True,,,,False,,,,,,CF_NIV_SUIV,,,CF_NIV_SUIV,,,,,,,,,CF_NIV_SUIV,,,,,,,,,,,CF_NIV_SUIV,True,,,,,CF_NIV_SUIV,[],CF_NIV_SUIV,2021-04-20 22:00:00,2021-05-30 22:00:00,CF_NIV_SUIV,,,,,Déclaration sans suite : motif d'intérêt général (insuffisance de concurrence pouvant résulter des exigences du cahier des charges / changement mode de gestion).
31,21-96116,CF_NIV_SUIV,CF_NIV_SUIV,21-95526,CF_NIV_SUIV,CF_NIV_SUIV,True,False,False,,,CF_NIV_SUIV,True,,,,False,,,,,,CF_NIV_SUIV,,,CF_NIV_SUIV,,,,,,,,,CF_NIV_SUIV,,,,,,,,,,,CF_NIV_SUIV,True,,,,,CF_NIV_SUIV,[],CF_NIV_SUIV,2021-07-07 22:00:00,2021-07-25 22:00:00,CF_NIV_SUIV,,,,,Erreur de procédure
32,21-96704,CF_NIV_SUIV,CF_NIV_SUIV,21-86936,CF_NIV_SUIV,CF_NIV_SUIV,True,False,False,,,CF_NIV_SUIV,True,,,,False,,,,,,CF_NIV_SUIV,,,CF_NIV_SUIV,,,,,,,,,CF_NIV_SUIV,,,,,,,,,,,CF_NIV_SUIV,True,,,,,CF_NIV_SUIV,[],CF_NIV_SUIV,2021-06-27 22:00:00,2021-07-29 22:00:00,CF_NIV_SUIV,,,,,"Considérant que le besoin faisant l'objet de la présente consultation doit être réexaminé, le pouvoir adjudicateur DECIDE l'abandon de la procédure en cours."
33,21-97154,CF_NIV_SUIV,CF_NIV_SUIV,21-93318,CF_NIV_SUIV,CF_NIV_SUIV,True,False,False,,,CF_NIV_SUIV,True,,,,False,,,,,,CF_NIV_SUIV,,,CF_NIV_SUIV,,,,,,,,,CF_NIV_SUIV,,,,,,,,,,,CF_NIV_SUIV,True,,,,,CF_NIV_SUIV,[],CF_NIV_SUIV,2021-07-05 22:00:00,2021-07-29 22:00:00,CF_NIV_SUIV,,,,,Publicité faite dans la mauvaise catégorie.Publicité refaite dans les marché de plus de 90 000 euro
34,21-97500,CF_NIV_SUIV,CF_NIV_SUIV,21-71433,CF_NIV_SUIV,CF_NIV_SUIV,False,True,False,,,CF_NIV_SUIV,True,,,,False,,,,,,CF_NIV_SUIV,,,CF_NIV_SUIV,,,,,,,,,CF_NIV_SUIV,,,,,,,,,,,CF_NIV_SUIV,True,,,,,CF_NIV_SUIV,[],CF_NIV_SUIV,2021-05-26 22:00:00,2021-08-23 22:00:00,CF_NIV_SUIV,,,,,Marché annulé du fait d'un lot infructueux impactant les autres lots
35,21-98605,CF_NIV_SUIV,CF_NIV_SUIV,21-87556,CF_NIV_SUIV,CF_NIV_SUIV,False,True,False,,,CF_NIV_SUIV,True,,,,False,,,,,,CF_NIV_SUIV,,,CF_NIV_SUIV,,,,,,,,,CF_NIV_SUIV,,,,,,,,,,,CF_NIV_SUIV,True,,,,,CF_NIV_SUIV,[],CF_NIV_SUIV,2021-06-24 22:00:00,2021-07-29 22:00:00,CF_NIV_SUIV,,,,,Le marché est déclaré sans suite.Une nouvelle procédure sera lancée fin 2021 compte tenu du décalage de mise en oeuvre des contrats de droit privé au sein de la structure.
36,21-99001,CF_NIV_SUIV,CF_NIV_SUIV,19-187656,CF_NIV_SUIV,CF_NIV_SUIV,True,False,False,,,CF_NIV_SUIV,True,,,,False,,,,,,CF_NIV_SUIV,,,CF_NIV_SUIV,,,,,,,,,CF_NIV_SUIV,,,,,,,,,,,CF_NIV_SUIV,True,,,,,CF_NIV_SUIV,[],CF_NIV_SUIV,2019-12-16 23:00:00,2020-01-26 23:00:00,CF_NIV_SUIV,,,,,Consultation déclarée 'Sans suite pour cause d4infructuosité': Aucune offre reçue
37,21-99138,CF_NIV_SUIV,CF_NIV_SUIV,21-96005,CF_NIV_SUIV,CF_NIV_SUIV,False,True,False,,,CF_NIV_SUIV,True,,,,False,,,,,,CF_NIV_SUIV,,,CF_NIV_SUIV,,,,,,,,,CF_NIV_SUIV,,,,,,,,,,,CF_NIV_SUIV,True,,,,,CF_NIV_SUIV,[],CF_NIV_SUIV,2021-07-08 22:00:00,2021-09-10 22:00:00,CF_NIV_SUIV,,,,,"L'avis d'attribution no21-96005 ne concerne pas le marché relatif à la déconstruction de l'ancienne Station de Traitement des Eaux Usées de Saint-Gilles (avis 21-68124), qui est en phase de consultation.L'avis d'attribution no21-96005 concerne la marché relatif à déconstruction des anciennes stations de traitement des eaux usées - la calmette - Dions et aménagement d'ouvrages tampons (avis 21-16791)."
38,21-99139,CF_NIV_SUIV,CF_NIV_SUIV,21-87111,CF_NIV_SUIV,CF_NIV_SUIV,False,True,False,,,CF_NIV_SUIV,True,,,,False,,,,,,CF_NIV_SUIV,,,CF_NIV_SUIV,,,,,,,,,CF_NIV_SUIV,,,,,,,,,,,CF_NIV_SUIV,True,,,,,CF_NIV_SUIV,[],CF_NIV_SUIV,2021-06-23 22:00:00,2021-07-29 22:00:00,CF_NIV_SUIV,,,,,La consultation est déclarée sans suite pour un motif d'intérêt général en raison d'une définition insuffisante des besoins
39,21-99339,CF_NIV_SUIV,CF_NIV_SUIV,21-79691,CF_NIV_SUIV,CF_NIV_SUIV,False,True,False,,,CF_NIV_SUIV,True,,,,False,,,,,,CF_NIV_SUIV,,,CF_NIV_SUIV,,,,,,,,,CF_NIV_SUIV,,,,,,,,,,,CF_NIV_SUIV,True,,,,,CF_NIV_SUIV,[],CF_NIV_SUIV,2021-06-10 22:00:00,2021-09-07 22:00:00,CF_NIV_SUIV,,,,,Cette déclaration sans suite a été rendue nécessaire après constatation d'un manquement au principe d'égalité de traitement entre les candidats.
40,21-99358,CF_NIV_SUIV,CF_NIV_SUIV,21-95805,CF_NIV_SUIV,CF_NIV_SUIV,False,True,False,,,CF_NIV_SUIV,True,,,,False,,,,,,CF_NIV_SUIV,,,CF_NIV_SUIV,,,,,,,,,CF_NIV_SUIV,,,,,,,,,,,CF_NIV_SUIV,True,,,,,CF_NIV_SUIV,[],CF_NIV_SUIV,2021-07-08 22:00:00,2021-08-02 22:00:00,CF_NIV_SUIV,,,,,Mauvaise définition du besoin.
